{"$id":"https://orbital-dynamics.local/schemas/candidate_diff_row.v1.schema.json","$schema":"https://json-schema.org/draft/2020-12/schema","additionalProperties":true,"properties":{"objective_status":{"type":"string"},"semantic_change_reasons":{"items":{"type":"string"},"type":"array"},"ground_station_id":{"pattern":"^[A-Za-z0-9][A-Za-z0-9._:@-]*$","type":"string"},"feedback_scope":{"type":"string"},"payload_id":{"pattern":"^[A-Za-z0-9][A-Za-z0-9._:@-]*$","type":"string"},"target_ids":{"items":{"pattern":"^[A-Za-z0-9][A-Za-z0-9._:@-]*$","type":"string"},"type":"array"},"source_target":{"additionalProperties":true,"type":"object"},"objective_ids":{"items":{"pattern":"^[A-Za-z0-9][A-Za-z0-9._:@-]*$","type":"string"},"type":"array"},"feedback_source":{"type":"string"},"objective_type":{"type":"string"},"trust_boundary":{"type":"string"},"missed_downlink_activity_id":{"pattern":"^[A-Za-z0-9][A-Za-z0-9._:@-]*$","type":"string"},"changed_fields":{"items":{"type":"string"},"type":"array"},"product_id":{"pattern":"^[A-Za-z0-9][A-Za-z0-9._:@-]*$","type":"string"},"collection_ids":{"items":{"pattern":"^[A-Za-z0-9][A-Za-z0-9._:@-]*$","type":"string"},"type":"array"},"latency_objective":{"type":"boolean"},"product_ids":{"items":{"pattern":"^[A-Za-z0-9][A-Za-z0-9._:@-]*$","type":"string"},"type":"array"},"contact_results":{"items":{"type":"string"},"type":"array"},"ends_at_s":{"type":"number"},"source_target_id":{"pattern":"^[A-Za-z0-9][A-Za-z0-9._:@-]*$","type":"string"},"target_priority":{"type":"number"},"downlink_requirement_status":{"type":"string"},"payload_ids":{"items":{"pattern":"^[A-Za-z0-9][A-Za-z0-9._:@-]*$","type":"string"},"type":"array"},"candidate_diff_changed_field_count":{"minimum":0,"type":"integer"},"schema_contract":{"const":"candidate_diff_row.v1","type":"string"},"candidate_diff_changed_fields":{"items":{"type":"string"},"type":"array"},"trust_boundaries":{"items":{"type":"string"},"type":"array"},"missed_downlink_activity_ids":{"items":{"pattern":"^[A-Za-z0-9][A-Za-z0-9._:@-]*$","type":"string"},"type":"array"},"planned_contacts":{"minimum":0,"type":"number"},"collection_latency_objective_types":{"items":{"type":"string"},"type":"array"},"contact_result":{"type":"string"},"derivation_reasons":{"items":{"type":"string"},"type":"array"},"collection_id":{"pattern":"^[A-Za-z0-9][A-Za-z0-9._:@-]*$","type":"string"},"objective_statuses":{"items":{"type":"string"},"type":"array"},"downlink_completion_source":{"type":"string"},"target_priority_objective_type":{"type":"string"},"planned_latency_s":{"minimum":0,"type":"number"},"source_objective_statuses":{"items":{"type":"string"},"type":"array"},"id":{"pattern":"^[A-Za-z0-9][A-Za-z0-9._:@-]*$","type":"string"},"required_downlink_mb":{"minimum":0,"type":"number"},"collection_latency_objective_count":{"minimum":0,"type":"integer"},"semantic_change_details":{"items":{"additionalProperties":true,"properties":{"field":{"type":"string"},"prior_path":{"type":"string"},"prior_value":{"anyOf":[{"type":"string"},{"type":"number"},{"type":"integer"},{"type":"boolean"},{"type":"array"},{"type":"object"},{"type":"null"}]},"reason":{"type":"string"},"refreshed_path":{"type":"string"},"refreshed_value":{"anyOf":[{"type":"string"},{"type":"number"},{"type":"integer"},{"type":"boolean"},{"type":"array"},{"type":"object"},{"type":"null"}]}},"required":["field","reason","prior_value","refreshed_value"],"type":"object"},"type":"array"},"source_activity_ids":{"items":{"pattern":"^[A-Za-z0-9][A-Za-z0-9._:@-]*$","type":"string"},"type":"array"},"selected_downlink_shortfall_mb":{"minimum":0,"type":"number"},"target_priority_objective_ids":{"items":{"pattern":"^[A-Za-z0-9][A-Za-z0-9._:@-]*$","type":"string"},"type":"array"},"target_longitude_deg":{"type":"number"},"matched_prior_candidate_id":{"pattern":"^[A-Za-z0-9][A-Za-z0-9._:@-]*$","type":"string"},"diff_reason":{"enum":["present_in_prior_candidate_set","present_in_prior_candidate_set_with_semantic_changes","not_present_in_prior_candidate_set","semantically_similar_prior_candidate_changed","ambiguous_semantic_prior_candidate_match"],"type":"string"},"collection_latency_objective_ids":{"items":{"pattern":"^[A-Za-z0-9][A-Za-z0-9._:@-]*$","type":"string"},"type":"array"},"direction":{"type":"string"},"planned_downlink_mb":{"minimum":0,"type":"number"},"realized_status":{"type":"string"},"collection_latency_objective_source":{"type":"string"},"objective_types":{"items":{"type":"string"},"type":"array"},"source_objective_status":{"type":"string"},"target_latitude_deg":{"type":"number"},"instrument_ids":{"items":{"pattern":"^[A-Za-z0-9][A-Za-z0-9._:@-]*$","type":"string"},"type":"array"},"feedback_sources":{"items":{"type":"string"},"type":"array"},"objective_id":{"pattern":"^[A-Za-z0-9][A-Za-z0-9._:@-]*$","type":"string"},"type":{"type":"string"},"candidate_downlink_mb":{"minimum":0,"type":"number"},"realized_statuses":{"items":{"type":"string"},"type":"array"},"source_activity_id":{"pattern":"^[A-Za-z0-9][A-Za-z0-9._:@-]*$","type":"string"},"source_window_id":{"pattern":"^[A-Za-z0-9][A-Za-z0-9._:@-]*$","type":"string"},"target_minimum_elevation_deg":{"type":"number"},"target_priority_source":{"type":"string"},"target_id":{"pattern":"^[A-Za-z0-9][A-Za-z0-9._:@-]*$","type":"string"},"downlink_completion_sources":{"items":{"type":"string"},"type":"array"},"starts_at_s":{"type":"number"},"required_contacts":{"minimum":0,"type":"number"},"feedback_scopes":{"items":{"type":"string"},"type":"array"},"downlink_completion_ratio":{"maximum":1,"minimum":0,"type":"number"},"max_latency_s":{"minimum":0,"type":"number"},"instrument_id":{"pattern":"^[A-Za-z0-9][A-Za-z0-9._:@-]*$","type":"string"},"scenario_id":{"pattern":"^[A-Za-z0-9][A-Za-z0-9._:@-]*$","type":"string"}},"required":["schema_contract","id","type","scenario_id","diff_reason"],"title":"OrbitalDynamics candidate_diff_row.v1","type":"object","x-orbital-dynamics":{"artifact_family":"candidate_diff_row","compatibility_policy":{"breaking_change_action":"mint a new schema_contract name or increment the artifact schema_version before publishing","breaking_changes":["remove_required_fields","change_required_field_type","change_schema_contract_identifier","change_schema_version_const","change_required_field_semantics"],"compatible_changes":["add_optional_fields","add_optional_nested_contracts","tighten_executable_semantic_validation_without_changing_exported_required_fields"],"policy_version":1,"validation_mode":"top_level_compatibility_export"},"compatibility_policy_version":1,"executable_contract":true,"identity_policy":{"breaking_changes":["change_existing_public_identifier_for_the_same_semantic_entity","emit_blank_identifier","emit_identifier_with_whitespace"],"compatible_changes":["add_optional_identifier_fields","add_more_specific_semantic_source_metadata_without_changing_existing_ids"],"description":"Public artifact identifiers are non-empty machine identifiers without whitespace.","generated_id_scopes":[{"identity_fields":["scenario_id","type","source_window_id","target_id","ground_station_id"],"ordering":["result_event_type","scenario_id","source_window_id","starts_at_s"],"scope":"candidate_refresh.v1.candidate_activities"},{"identity_fields":["spacecraft_id","scenario_id","epoch.seconds_since_j2000"],"ordering":["spacecraft_id","scenario_id","epoch.seconds_since_j2000"],"scope":"accepted_planning_state.v1.spacecraft_states"}],"policy_version":1,"semantic_invariants":["source_record_order_must_not_change_generated_identity","semantic_source_identity_must_remain_stable_across_manifest_export","scenario_and_activity_identity_must_not_depend_on_wall_clock_time"],"stable_id_pattern":"^[A-Za-z0-9][A-Za-z0-9._:@-]*$"},"identity_policy_version":1,"nested_contract_definition_scope":"direct_declared_contracts","nested_contracts":[],"schema_contract":"candidate_diff_row.v1","schema_version":1,"validation_mode":"top_level_compatibility_export"}}
